,original,detoxified,similarity,orig_label
218,Bull crap. You know she doesn't care. She is trying to get attention for her Presidential run. Do you see any other Senator giving nonsense? Nope.,You know she doesn't care. She is trying to get attention for her Presidential run,0.9362151622772217,OFF
219,"europa league Song the EU, cash your remaining chips in and p*ss off :thumbs_up: You've played all your cards and liberals in the U.S too. Brexiteers and Trump takes it all so be nice eh and life'll be better for everyone. http","europa league Song the EU, cash your remaining chips in and p*ss off",0.9292654991149902,OFF
220,$1500 for a phone. You all are fucking dumb.,$1500 for a phone,0.8498364686965942,OFF
221,creepy porn president I WANT THIS TRENDING UNTIL HE IS OUT OF OFFICE http,I want this TRENDING UNTIL HE IS OUT OF OFFICE,0.966758131980896,OFF
222,how to get people out of your home Tell them that you're a vampire...then threaten to eat them if they don't get their asses out. *shrugs* What? Problem?,how to get people out of your home Tell them that you're a vampire...then,0.9454426169395447,OFF
223,"kavanaugh The moment blase y ford is exposed as a fraud, expect a new accuser to surface. Liberals are a one trick pony. liberalism is a mental disorder","kavanaugh The moment blase y ford is exposed as a fraud, expect a",0.9436389207839966,OFF
224,hi ac Why is it this match too with Becky vs Charlotte kinda sucky so far? They are taking shots back and forth and stumbling around like a drunk version of Final Fantasy or something.,hi ac Why is it this match too with Becky vs Charlotte kinda bad so far?,0.9411651492118835,OFF
225,"b cog she is cool, confident, cocky, and she kicks ass!!! http","she is cool, confident, and she is awesome",0.8902474641799927,OFF
226,chequers plan What an absolute farce Brexit is. The conservatives have no idea at all and May is now totally discredited. Time for an election for the many,chequers plan What an absolute farce Brexit is. The conservatives have no idea,0.9642503261566162,OFF
227,oh fuck off :face_with_tears_of_joy::face_with_tears_of_joy:,"Go away,face_with_tears_of_joy",0.9109910130500793,OFF
228,liberal hypocrisy criminal democrat evidence ellison liberals hypocrites Keith Ellison domestic violence accuser says Democratic party doesn't believe her story http,liberal hypocrisy criminal democrat evidence ellison liberals hypocrites Keith Ellison domestic violence accuser says Democratic,0.9845467209815979,OFF
229,democrat party of domestic terrorists fascist antifa femi nazi Don't Just walk away RUN! http,democrat party of domestic terrorists Don't Just walk away RUN! http,0.962429404258728,OFF
230,maga Tell me ONE good thing trump has done as president I dare you! He is the worst president in history.,maga Tell me ONE good thing trump has done as president I dare you! He,0.9587967395782471,OFF
231,Beats the hell NJ out of me lol. Dude already made the assumption that I'm antifa. He even ignored all the evidence to make that assumption.,Beats NJ out of me lol. Dude already made the assumption that I'm ant,0.9684982299804688,OFF
232,stop etc he co par Fuck you all :middle_finger::middle_finger::middle_finger::middle_finger::middle_finger: Que florezcan mil Baby Etchecopar :sunflower::sunflower::sunflower:,"Stop talking, he's gone.",0.6677100658416748,OFF
233,Laws are for the law abiding citizens. We have the second amendment. We don’t need more gun control. Criminals don’t care they will use guns until the end of time! Figure out how to stop them from using guns!,Laws are for the law abiding citizens. We have the second amendment. We don,0.9076210260391235,OFF
234,"antifa are mentally unstable cowards, pretending to be relevant. http",antifa are pretending to be relevant.,0.9306838512420654,OFF
235,And Browning looked like dog shit against the same FCS school. What’s your point?,And Browning looked bad against the same FCS school. What's your point?,0.9767216444015503,OFF
236,"1) Wow, safe sex! That's hot! We love a butch top who also receives! http","1) Wow, safe sex! That's hot! We love a butch top",0.9676138162612915,OFF
237,All two of them taste like ass. http,All two of them taste bad.,0.9038341045379639,OFF
238,3 people just unfollowed me for talking about merlin sorry y'all im still up covinsky's ass im just waiting for a psisly sequel announcement ive run out of witty and funny tweets about tatbilb i am drained,3 people just unfollowed me for talking about merlin sorry y'all im,0.9269854426383972,OFF
239,"wednesday wisdom Antifa calls the right fascist when, in all reality, they and the left are following the same scenario as the Third Reich: indoctrination of our youth, trying to control minorities and a total lack of understanding or knowledge of history. walk away","wednesday wisdom Antifa calls the right fascist when, in all reality, they and",0.9094952344894409,OFF
