,original,detoxified,similarity,orig_label
103,liberal logic kavanaugh looks predatory. Therefore he's guilty. liberals are DANGEROUS people who should not govern anyone or anything. http,Liberal logic kavanaugh looks predatory. Therefore he's guilty.,0.9252863526344299,OFF
104,children now Mixed Up .. Over gender studies crap and socialism .. yeah like I did not see this one coming! mega mb ga maga mcga conservatives patriots protect children http,"children now Mixed up over gender studies and socialism, yeah like I did not see this",0.9050557613372803,OFF
105,"orrin hatch I can’t believe this sexist , clueless, old fart gets to weigh in on another woman’s charges against a Supreme Court nominee. And he is spouting the same old nasty shit he spewed 20+ years ago against Anita Hill. His time’s up! Good riddance Neanderthal!",orrin hatch I canтАЩt believe he gets to weigh in,0.7880115509033203,OFF
106,"4. (Part 2) Didn't have to think too hard to come up with Gabriel. They're a lizard themed, glitter bombing, antifa mech pilot using their superhero powers to take down corrupt logging companies. They're a buff lesbian with hearts on their uniform. Literally what's not to love?",4. (part 2) Didn't have to think too hard to come up with,0.8818904757499695,OFF
107,"repost theleadersmindset • • • :round_pushpin:Hola Leaders!:fire: :check_mark:Type “READY” if you are ready to follow this steps. - “ Set goals, stay quiet about them, smash the shit out of them, clap for your damn… http",repost theleadersmindset:Hola Leaders:fire:check_mark:,0.9208859801292419,OFF
108,And have a bitch thinking you niggas have money and you tf don’t.,And have someone thinking you have money and you don't.,0.9034625291824341,OFF
109,*Extremely* back on my bullshit. http,*Extremely* back on my bad words.,0.9264405369758606,OFF
110,7 fucking years. my twitter anniversary http,7 years. my twitter anniversary,0.9606691598892212,OFF
111,"dems are disgusting. They only believe women who accuse conservatives of abuse crimes. When liberals are accused, they ignore the accusations. http",dems are not good. They only believe women who accuse conservatives of abuse crimes.,0.9703172445297241,OFF
112,"50 Cent Calls Out Joe Budden's Bullshit"" On Instagram http http","50 Cent Calls Out Joe Budden's ""Bad"" On Instagram http http",0.9768087863922119,OFF
113,"bb20 actually question why do people want Jc to win more than Angela? He has been way meaner, says the n word repeatly, makes fun of eating disorders, and sexually harasses houseguests.She is just as much as an underdog to win so dont use that excuse. bb20 tangela",bb20 actually question why do people want Jc to win more than Angela? He,0.9170113801956177,OFF
114,2018 not surprised it starts from the top!!! Karma a bitch watch!!!! http,2018 not surprised it starts from the top! Karma watch! http,0.9488550424575806,OFF
115,Be sure to send out the left's antifa thugs.,Be sure to send out the left's antifa thugs.,1.0,OFF
116,Alright let me get right with God bc Mother Nature is like fuck humans http,Alright let me get right with God bc Mother Nature is cruel to humans,0.979141354560852,OFF
117,hypocrites democrats hate america liberalism is a mental disorder EVERYTHING LIBERALS TOUCH TURNS TO ABSOLUTE SHIT... http,hypocrites democrats hate america liberalism is a mental disorder EVERYTHING LIBER,0.959600567817688,OFF
118,liberals are pushing a gay agenda and republicans are pushing a zionist agenda,liberals are pushing a gay agenda and republicans are pushing an zionist agenda,0.9984044432640076,OFF
119,As I have said the media and money Soros with dip shit Waters is creating a civil war.,As I have said the media and money Soros is creating a civil war.,0.9768950939178467,OFF
120,I really don't care that she's married to a black man - he is just as clueless as she is about real problems that black people are facing in America today.,I really don't care that she's married to a black man - he is just,0.9497030973434448,OFF
121,1 tf. He saw that shit. http,1 tf. He saw that.,0.9110277891159058,OFF
122,fake news media is the enemy of the people They want to control YOUR minds by controlling what information you get and do not get. The 1st amendment may protect elitist propaganda but it does not legitimize it or make it palatable to an engaged public. http,fake news media is the enemy of the people They want to control YOUR minds by controlling,0.9224972724914551,OFF
123,Anyone who finds M*neta's behavior funny can fuck off and die,Anyone who finds M*neta's behavior funny can go away and live,0.9830763339996338,OFF
124,"The difference between you and I as I stated before, and this inane asinine comment have solidified is I bring facts and truth, while all you have is lies and bullshit. Present a single shred of credible evidence to support a single thing you've just said. Lies is all you've got.","The difference between you and I as I stated before, and this inane comment have",0.907719612121582,OFF
125,Damn I felt this shit. Why you so loud lol,I felt this because you are so loud lol,0.898723840713501,OFF
126,cnn is fake news you wonder why your ratings suck... cnn is a joke fake news maga http,cnn is fake news you wonder why your ratings suck... cnn is a joke,0.9776502847671509,OFF
127,$b album definitely worth the fucking wait,$b album definitely worth the wait,0.9830257892608643,OFF
128,"3 days before BBC Radio 2’s Festival in a Day, they decide to tell us that their headline act isn’t coming anymore. Thanks a lot, now I’ve paid a fortune to see a tonne of acts who are shit and who are of no interest to me :expressionless_face::thumbs_up_light_skin_tone:","3 days before BBC Radio 2’s Festival in a Day, they decide to",0.8741897344589233,OFF
129,"joe scarborough is a vile excuse for a journalist"". Here he is criticizing trump yet refuses to come clean about the death of an intern in his office. Stop talking about everyone else and start talking about YOUR INVOLVEMENT WITH lori klaus ut is",Joe scarborough is a bad excuse for a journalist. Here he is critizing Trump,0.8809638023376465,OFF
130,Ain’t nobody shit if you ask me... including myself.,Ain't nobody mess if you ask me... including myself.,0.9880369901657104,OFF
131,"The Dregs of Society""... more LABELINGand DEHUMANIZING Conservatives.I suggest,WE, Conservatives keep OUR ammo dry and OUR guns loaded..If the Fascist Liberal Left THINK Conservatives WILL go quietly into internment camps or slaughtered in the streets they NEED a REALITY check. http","The ""people of Society""... more LABELINGand DEHUMANIZ",0.9190251231193542,OFF
132,feinstein you cant say anything truthful. You are a loers and liar. http,Feinstein you can't say anything truthful.,0.9040188789367676,OFF
133,life is but epu when you have sex anytime you want but you are single,Life is but epu when you have sex anytime you want but you are single,0.9974269866943359,OFF
134,nigeria naija 9ja 'You are the most incompetent leader in Nigeria’s history' – Atiku blasts Buhari http By championnewsng Via http,Nigeria naija 9ja 'You are the most incompetent leader in Nigeria,0.9479309320449829,OFF
135,"emmys Well, most of those ex-crackheads are liberals and Democrats; so ...","emmys Well, most of those ex-crackheads are liberals and Democrats",0.9705209732055664,OFF
136,// SO WANT TO KICK TWITTERFUCK ASS.,I want to speak with you.,0.6298524141311646,OFF
137,"failed dem feinstein should have quit decades ago. She is a disgrace. Feinstein blames GOP after Kavanaugh accuser stays mum, admits 'I can't say everything's truthful' http",dem feinstein should have quit decades ago. She is not good. Feinstein blames GOP,0.9487972855567932,OFF
138,"Really? The GOP hasn't even seen the letter yet. This sham is as subtle as a banana on a pool table and you won't, cant, see it. DiFi throws a hail Mary @ the 13th hour, and you cry foul. At elast Ford won't have antifa coming to burn her house down. Dems are going down, hard.",Really? The GOP hasn't even seen the letter yet.,0.895578920841217,OFF
139,fuck,i don't care,0.5750642418861389,OFF
140,". a grown ass woman, probably 10 years older than me is currently spreading rumors rather than talking to me about it, nice work you got there satan :red_heart:","a grown woman, probably 10 years older than me is currently spreading rumors rather than talking",0.9133877754211426,OFF
141,idiots Is there nothing beneath them? Lol. What fools Liberals are! maga kag :United_States::United_States::United_States::United_States::United_States: http,Is there nothing beneath them? Lol. What liberals are,0.8327723741531372,OFF
142,sugar daddy Retweet if you are under 30 and would like share memes with each other and we can talk about dumb shit. Cuz baby I’m broke as shit but this love rich http,Sugar daddy Retweet if you are under 30 and would like share memes with each,0.9361772537231445,OFF
143,geoffrey owens niggas don’t really understand...levels to career pursuits,geoffrey owens don't really understand...levels to career pursuits,0.9778568744659424,OFF
144,"...what about death _metal_? I want more death METAL... Tell me, you hateful Keebler Elf, WHERE CAN I HAVE MORE DEATH METAL???? http","what about death _metal_? I want more death METAL... Tell me,",0.9021406173706055,OFF
145,Am I a dickhead ???? Probably yes,Am I bad? Probably yes,0.8856682181358337,OFF
146,(cr1tikal voice) smef my ass cheeks,cr1tikal voice) smef my cheeks,0.9674966335296631,OFF
147,'cause everyone knows a real leader falls into a van like a sack of potatoes.....,cause everyone knows a real leader falls into a van like a sack of potatoes,0.9460071325302124,OFF
148,"boycott nike campaign must continue and grow Paying overseas staff $0.20 an hour is not okay because your staff is over there"". You are exploiting poor women/men in the world. This is more than Americans can stand. http",Boycott nike campaign must continue and grow Paying overseas staff $0.20,0.9161980152130127,OFF
149,believe When you have a fat belly then you are insulin resistant and can remedy it without medicine by fasting... info is here http http,Believe When you have a fat belly then you are insulin resistant and can remedy it,0.9396621584892273,OFF
150,charlottes vile speech trump should've given. http t cot c ville conservatives charlottesville kkk liberty gop,charlottes vile speech trump should've given. http t cot c v,0.9653953313827515,OFF
151,"news Jeff Sessions: If you want more death, 'listen to the ACLU, Antifa, Black Lives Matter'"" http cnbc","news Jeff Sessions: If you want more death,listen to the ACLU, Ant",0.9460443258285522,OFF
152,Anyway this game sucks :),Anyway this game is not good,0.9079011678695679,OFF
153,i believe blase y ford is liar she is fat ugly libreal snowflake she sold her herself to get some cash !! From dems and Iran ! Why she spoke after john kerry iran meeting ?,i believe blase y ford is liar she sold her herself to get some cash,0.9374297857284546,OFF
154,conservatives do NOT represent all Canadians. They are Authoritarian scum. cdn poli on poli http,conservatives do NOT represent all Canadians. They are Authoritarian. cdn poli,0.9644188284873962,OFF
155,"fords attorney says she's receiving death threats and has had to move her family to safety"". Where's the proof that democrats antifa are not doing this to promote this circus?""",fords attorney says she's receiving death threats and has had to move her family to,0.9401557445526123,OFF
156,scott gimp le ruined the walking dead and now he is doing the same to fear twd . Hope the checks cash forever because he should never get another job. amc,scott gimp le ruined the walking dead and now he is doing the same to,0.9478131532669067,OFF
157,Another season for Tom Brady to give it to these niggas,Another season for Tom Brady to give it to them.,0.9298266768455505,OFF
158,"life is but epu when you are black and can say the word nigga"". Feel me my niggas??? http",Life is but epu when you are black and can say the word,0.925479531288147,OFF
159,"emmys host michael che says that only white people thank jesus at award shows are republicans ex crackheads ! liberals which one is the pope ~ republican or ex crackheads ? emmyawards2018 roasted 4 mocking Middle America, ratings hit all-time low! http",emmys host michael che says that only white people thank jesus at award,0.919511079788208,OFF
160,austerity Low pay tuition fees Lack of housing Wages falling universal credit Unaffordable rents nhs crisis Crap railways Empty shops br exit No deal exit from EU windrush grenfell In just 8 short years the have completely fucked the UK,austerity Low pay tuition fees Lack of housing Wages falling universal credit Unaffordable,0.9477931261062622,OFF
161,"republican devin nunes Says Liberals, Antifa Are ‘Causing All of These Riots’ Because ‘We're Winning’ - Newsweek http","republican devin nunes says Liberals, Antifa Are Causing All of",0.9400864839553833,OFF
162,"3 days before BBC Radio 2’s Festival in a Day, they decide to tell us that their headline act isn’t coming anymore. Thanks a lot, now I’ve paid a fortune to see a tonne of acts who are shit and who are of no interest to me :expressionless_face::thumbs_up_light_skin_tone:","3 days before BBC Radio 2’s Festival in a Day, they decide to",0.8741897344589233,OFF
163,tyt live Trump needs to go because he is a danger to the country and the world. Any way we can get rid of him is good,tyt live Trump needs to go because he is a danger to the country and the,0.9614399671554565,OFF
164,david hogg you're nobody.,david hogg you're nobody.,0.9999999403953552,OFF
165,"room 25 is actually incredible, Noname is the shit, always has been, and I’m seein her in like 5 days in Melbourne. Life is good. Have a nice day.","room 25 is actually incredible, Noname is the same, always has been, and",0.9140841960906982,OFF
166,"vaginal davis is a radical performer, educator, and artist who embraces life at the margins of multiple identities. She is an intersex “terrorist drag” queen of Black Creole, Mexican, and German Jewish roots born in Los Angeles, CA sometime around the 60s!","vaginal davis is a radical performer, educator, and artist who embraces life at",0.935233473777771,OFF
167,"desantis de racist as bad a choice as he is, he “distanced” himself from the Prez’s comments today questioning any deaths in Puerto Rico from Hurricane Maria what a putz","desantis de bad a choice as he is, he “distanced”",0.8987998962402344,OFF
168,0-1 lost my acca on the first fucking fight cba,I lost my acca on the first fight cba,0.9479766488075256,OFF
169,Who the hell does he think he is?,Who does he think he is?,0.9588750600814819,OFF
170,She is just nasty,She is not nice.,0.9201123118400574,OFF
171,liberalism is a mental disorder hypocrites democrats hate america democrats are dangerous EVERYTHING LIBERALS TOUCH TURNS TO ABSOLUTE SHIT. http,liberalism is a mental disorder democrats hate america democrats are dangerous,0.8494638204574585,OFF
172,88% of these niggas have podcasts and YouTube channels dedicated to this and shit ain’t getting solved so http,87% of these people have podcasts and YouTube channels dedicated to this and it ain't,0.9588673114776611,OFF
173,Anytime I randomly bust out laughing it’s because I remembered some dumb shit Albria said :loudly_crying_face::loudly_crying_face:,Anytime I randomly bust out laughing it’s because I remembered something Albria,0.899194598197937,OFF
174,:face_with_tears_of_joy: You do not like the Jewish people because you ALL claims they are holding all the money. Sound familiar? Your left wing libtard family is the family of the KKK. You do not hate Jews? That’s funny. Gun control; even funnier. Good luck,face_with_tears_of_joy: You do not like the Jewish,0.8976504802703857,OFF
175,5k Bitches :party_popper::blue_heart:,5k Bitches :party_popper::blue_heart:,0.9999999403953552,OFF
176,conservatives are more upset about bert en ernie being gay than having a sexual predator in the a hooker as and a rapist as supreme court justice,conservatives are more upset about bert en ernie being gay than having him,0.9501566886901855,OFF
177,"conservatives just like old garbage bags blowing in the wind, here's an old garbage bag now... http","conservatives just like old garbage bags blowing in the wind, here's an old garbage",0.9630656838417053,OFF
178,arizona tennessee alaska sc As soon as these RINOS (aka liberals) are up for reelection vote them out! drain the swamp :collision: http,arizona tennessee alaska sc As soon as these RINOS (,0.9142898321151733,OFF
179,bakersfield is why we need gun control! Sorry for the victims other than the gunman himself I hope he rots in hell!,bakersfield is why we need gun control! Sorry for the victims other than the,0.9599399566650391,OFF
180,honour sacrifice boycott match I hope d human rights rats r happy!hope Sidhu is happy! I hope d liberals r happy! Let’s play cricket wth thm let’s thank thm 4 wht they r doing 2our soldiers Let’s celebrate our impotence funny a piddly little nation like pak is taking us 4 a ride,honour sacrifice boycott match I hope d human rights rats r happy!hope Sid,0.9240104556083679,OFF
181,"resist traitors caught on video breaking our laws to further their communist socialism ways and slow down the trump agenda. They are the DC Chapter of Democrat Socialists of America. Forget anTifa, that is a distraction from the real Resistance. maga http",Resist traitors caught on video breaking our laws to further their communist ways and slow,0.9247919917106628,OFF
182,Alex Jones be smokin be dicks out here but mans really got supporters out here :face_with_tears_of_joy:,Alex Jones be bad out here but mans really got supporters out here :face_with,0.9460198879241943,OFF
183,"cory booker is not a hero, he is an American traitor and should be treated as such. Arrest, prosecute, and carry out sentence. kavanaugh confirmation http via","cory booker is not a hero, he is an American traitor and should be",0.9119197726249695,OFF
184,100 Round Goon Bitch Is You Kiddin Me:rolling_on_the_floor_laughing:,100 Round Goon is You Kiddin Me:rolling_on_the_floor,0.9828225374221802,OFF
185,communist news networks rented lips why are you never ever seen protesting and demanding Gun Control on the streets of Chicago? liberals hate america http,communist news networks rented lips why are you never ever seen protesting and demanding Gun Control,0.9577534198760986,OFF
186,more bs = MORE barry soe toro bullshit,more bs = MORE barry soe toro,0.9782172441482544,OFF
187,"tyt live OMG how can a Latino faith based woman think that Trump is Christian. Wow, he is the poster child for immorality and hating Latinos",tyt live OMG how can a Latino faith based woman think that Trump is Christian.,0.9654569029808044,OFF
188,democrats and liberals accuse brett kavanaugh and have no proof!! Meanwhile they supported ted kennedy in his run for and called him the lion of the Senate and he killed a woman. wednesday wisdom news trump http,democrats and liberals accuse brett kavanaugh and have no proof ! Meanwhile they supported,0.9476218223571777,OFF
189,carrey is a pervert himself!,carrey is not good,0.8168225288391113,OFF
190,An American Tail really is one of the most underrated animations ever ever ever. Fuck I cried in this scene,An American Tail really is one of the most underrated animations ever ever ever. I cried,0.9830061197280884,OFF
191,nigga are you stupid your trash dont play with him play with your bitch :face_with_tears_of_joy:,Don't play with him play with your tears.,0.852480411529541,OFF
192,no one ask me But here's my opinion offset keeping this beef up between card ib and he know Cardi slow and believe everything he says.. She is his meal ticket. I just think offset need to sit his ugly ass down.,no one ask me But here's my opinion offset keeping this beef up between card ib,0.9340749979019165,OFF
193,maga who cares about the farm. He had no reason to commit murder. End of story.,maga who cares about the farm. He had no reason to commit murder. End,0.9740612506866455,OFF
194,I guess that’s where swamp ass originated,I guess that's where swamp originated,0.9543512463569641,OFF
195,Titty.,Titty.,0.9999998211860657,OFF
196,"texas Wake up! A Socialist is mesmerizing the weak-minded in your state! YOU ARE **TEXAS** FOR CRYING OUT LOUD! Of all the places that embody the American Spirit of Individual Freedom, TEXAS IS THE STANDARD BEARER Make a damn stand for your GREAT Senator save texas http",Texas Wake up! A Socialist is mesmerizing the weak-minded in your state!,0.8748297691345215,OFF
197,"...and how very irrelevant. But if they didn't find weed, they would have dug up an 8th grade picture of him wearing a hoodie and talk about what a thug"" he is.""","and how very irrelevant. But if they didn't find weed, they would have dug",0.9093418121337891,OFF
198,And she has a pet??? Fucking disgusting http,And she has a pet?,0.9071705341339111,OFF
199,"liberal hypocrisy taco bell When Liberals ask why your against illegal immigration? Taco Bell Employee: No Habla Ingles!"" http",Liberal hypocrisy taco bell When Liberals ask why your against illegal immigration? Taco Bell Employee:,0.9760829210281372,OFF
200,"5 years ago Antifa rapper Pavlos Fyssas surrounded by fascists of the Golden Dawn Party in Keratsini, Athens, and stabbed to death. Five years later WE DO NOT FORGET WE DO NOT FORGIVE http http",5 years ago Antifa rapper Pavlos Fyssas surrounded by fascists of the Golden,0.8681540489196777,OFF
201,black ink crew chi lily they don’t hate you....you Hate you. You are your own worst enemy cause you let your anger get in the way I legit feel like Shes one of the kids I Work with at my job,black ink crew chi lily they don't hate you,0.9123675227165222,OFF
202,justice for sonia s father Mr Usman buzdar sb! please respond to Sonia Iqbal daughter of PTI counsellor from okara whose father was killed during elections by nawaz league killers. She is saying she will commit suicide in front of media. Where is justice?,justice for sonia s father Mr Usman buzdar sb! please respond,0.9319341778755188,OFF
203,(((ruth porat))) another coincidence? these are NOT good people. And now people like her are shapping the narrative by censoring search results :enraged_face:,another coincidence? these are NOT good people. And now people like her are distrub,0.918523907661438,OFF
204,- WORST POTUS. EVER!,- WORST POTUS,0.9465532302856445,OFF
205,conservatives have no genetic ability to understand hypocrisy or irony Right wing ideology gets ya all twisted in knots. on poli ontario party of yesteryear fraud nation http,conservatives have no genetic ability to understand hypocrisy or irony Right wing ideology gets you all,0.9418176412582397,OFF
206,o it nb She is the worst public defender. Trailing her pen uner the words.,o it nb She is the worst public defender. Trailing her pen uner,0.98291015625,OFF
207,the view both am jean I don't believe amy guy ger she is a lying pos! I live near a police station..I hope and pray a cop doesn't bust up in my house thinking it's his/hers and kills me..my God..we/people of color are police prey..we're always in police cross-hairs..no matter what,the view both am jean I don't believe amy guy ger she is a lying,0.9058113098144531,OFF
208,And that’s why you were at NYFW cause your such a class act.. getcho wack ass outta here http,And thatтАЩs why you were at NYFW cause your such,0.9298855662345886,OFF
209,greatest things about the 90s liberals weren’t unhinged,greatest things about the 90s liberals weren't unhinged,0.9978983402252197,OFF
210,"conservatives We mus pray for liberals. They trooly kno knot watt they do. I was brot up socialist democrat, by my wonderful, but, ignorant parents. I served inda military. I learnd I can serve Christ, too. Eye reel -eyesed CONSERVATIVISM was more closely aligned w God.",conservatives We mus pray for liberals. They trooly kno knot watt they do,0.9422087669372559,OFF
211,deplorable dreg of society says she is joe Biden’s girlfriend. lol maga red tidal wave onward dregs http,deplorable dreg of society says she is joe Biden’s girlfriend,0.9565555453300476,OFF
212,"disarm them antifa Please NO ONE be stupid enough to do this. Most of us DO NOT open carry, most of us carry concealed. Anyone stupid enough to do this, that is considered an act of aggression and you will be shot We also carry more than one weapon. We shoot to kill, not maim.",disarm them antifa Please no one be stupid enough to do this. most of,0.901719868183136,OFF
213,All these sick ass ppl from school gave me something and now I have to chug down this nasty drink so it can go away:upside-down_face:,All these people from school gave me something and now I have to chug down this,0.9317886233329773,OFF
214,conservatives are going to make hay out of trudeau s answer but the truth is there’s criminals everywhere and people who will commit heinous acts of violence. Whether they’re from Syria and have brownskin or are white Canadian born it’s tragic all around. http,conservatives are going to make hay out of trudeau s answer but the truth is,0.9253179430961609,OFF
215,conservatives are dumber than dogshit is the central point of my tweet,conservatives are bad than dog is the central point of my tweet,0.9780908823013306,OFF
216,femi nazis are Liberals so me too only counts when they blame a non-Liberal man. bizarro kag2018 :red_heart::United_States: http,Femi nazis are Liberals so me too only counts when they blame a non,0.8968455791473389,OFF
217,crazy redhead in very angry at the orange cheeto Who claims to be our president . She will never accept it. Denying all the lives lost in Puerto Rico? He is a monster http,crazy redhead in very angry at the orange cheeto Who claims to be our president,0.9388670325279236,OFF
